<?xml version="1.0" encoding="UTF-8"?>
<!DOCTYPE tvshow SYSTEM "tvshow5.dtd">
<?xml-stylesheet type="text/xsl" href="tvshow5.xsl" ?>
<tvshow>
  <show>
    <name id_code="show_001">Life On Mars</name>
    <release>2008</release>
    <network country="US">ABC</network>
    <description>The series tells the story of New York City police detective Sam Tyler. &great; &tv_disclaimer;</description>
    <actors>
		<actor>
			<real_name>Jason O'Mara</real_name>
			<character profession="Detective">Sam Tyler</character>
		</actor>
		<actor>
			<real_name>Michael Imperioli</real_name>
			<character profession="Detective">Ray Carling</character>	
		</actor>
	</actors>
	<poster href="http://ia.media-imdb.com/images/M/MV5BMTM4MDg2NTk1OF5BMl5BanBnXkFtZTcwNzI4OTY5MQ@@._V1._SY317_CR12,0,214,317_.jpg" width="214" height="317" />
    <viewers units="million">7.82</viewers>
    <end_date>2009</end_date>
  </show>
  
  <show>
    <name id_code="show_002">Life On Mars</name>
    <release>2006</release>
    <network country="UK">BBC</network>
    <description>The series combines elements of science fiction and police procedural. &great; &tv_disclaimer;</description>
    <actors>
		<actor>
			<real_name>John Simm</real_name>
			<character profession="Detective">Sam Tyler</character>
		</actor>
		<actor>
			<real_name>Philip Glenister</real_name>
			<character profession="Detective">Gene Hunt</character>	
		</actor>
	</actors>
	<poster href="http://ia.media-imdb.com/images/M/MV5BMTQxNzc5MjQwNF5BMl5BanBnXkFtZTcwMjU3Njc4Mg@@._V1._SY317_CR8,0,214,317_.jpg" width="214" height="317" />
    <viewers units="million">6.8</viewers>
    <end_date>2007</end_date>
  </show>
</tvshow>